Title,Content,Press,Date
‘김치 프리미엄’ 노린 4조원대 불법 외환송금… 은행은 몰랐다,"檢, 4개 조직 적발… 20명 기소‘페이퍼컴퍼니’로 무역대금 위장코인 차익 노린 단기 거래 반복범죄수익 최대 2100억원 추정연루 계좌 명의인 256명 확인4대 시중은행 등 9개 은행 거래“송금 부실 심사 악용… 개선 필요”최근 몇 년간 국내 가상화폐 등 가상자산 가격 급등에 따른 시세 차익, 이른바 ‘김치 프리미엄’을 노린 불법 해외 송금 사건이 잇따른 가운데, 총 4조3000억원 규모의 외화를 일본·중국·호주·홍콩 등에 불법 유출한 4개 조직이 검찰과 세관 당국에 적발됐다. 이들은 시중은행의 외환 송금 절차상 허점을 범행에 이용해 제도 개선 등 대책 마련이 필요하다는 지적이 나온다.  
   사진=AFP연합뉴스    서울중앙지검 국제범죄수사부(부장검사 나욱진)와 서울본부세관 조사2국(국장 이민근)은 18일 외국환거래법 위반, 특정경제범죄가중처벌법 위반(알선 수재) 등 혐의로 4개 조직 총책과 브로커 등 11명을 구속 기소하고, 9명은 불구속 기소했다고 밝혔다. 해외로 도주한 1명은 지명수배를 내렸다.     이들은 2021년 1월부터 지난해 8월까지 국내 코인 거래소의 가상자산 시세가 해외 코인 거래소의 시세보다 높은 점을 노리고 범행을 벌였다. 이 차익이 약 3∼5%, 많게는 20%를 웃돌 때 송금해, 해외 코인 거래소에서 가상자산을 사들여 국내 거래소로 보낸 뒤 매각하는 과정을 반복했다. 예를 들어 100억원이 100차례 순환하면 송금 규모가 1조원이 되는 구조다. 이를 통해 약 1200억∼2100억원을 챙긴 것으로 추산된다.     검찰과 세관은 5개월간 합동 수사를 벌여 1000여개 관련 계좌의 거래액 약 15조원을 추적·분석한 끝에 이들 조직이 서류상으로만 존재하는 무역 회사, 페이퍼 컴퍼니를 이용한 점을 밝혀냈다. 이들 회사에 계좌 명의인 기준으로 256명이 입금해 자금을 댔다. 대부분 투기 자금으로, 일각에서 제기된 대북 송금 정황은 확인되지 않았다.     구체적 수법은 조직별로 다양하지만 역할을 분담하는 분업형, 총책이 페이퍼 컴퍼니를 운영하는 기업형 등으로 조직적인 범행 설계가 이뤄졌다. 보이스피싱(전화금융사기) 조직과 유사하다.  
  이들의 범행엔 4대 은행(KB국민·신한·하나·우리) 등 시중은행 9곳이 연루됐다. 은행들은 고객 유치에 혈안이 돼 외환 송금 사유나 증빙 서류 심사를 제대로 하지 않은 것으로 조사됐다. 한 은행 지점에서만 5개월간 320여차례에 걸쳐 반도체 개발비 명목으로 1조4000억원 상당의 외화가 송금됐는데, 담당 직원은 포상을 받았다. 본점 차원에서 금융 당국에 의심거래보고(STR)를 했으나 지점엔 제대로 전달되지 않았다.     검찰 관계자는 “점포별로 (영업 실적에 따라) 개인의 평점 등과 연관이 있어 은행 입장에선 적극 심사해 불법 해외 송금을 막아야 한다는 의식이 없었다”며 “제도적 문제점이 있었다”고 설명했다.     검찰과 세관은 “은행 내부 책임자와 금융 당국이 적시에 개입해 불법 송금을 차단하지 못하는 이상 이 사건과 같은 단기간 ‘치고 빠지기’ 형태의 송금을 막을 수 없다”며 “은행권과 금융 당국이 연계한 제도 개선이 필요하다”고 지적했다.  
   서울 서초구 서울중앙지검의 모습. 연합뉴스    서울중앙지검은 지난해 7월 금융감독원에서 자료를 이첩받아 9월부터 서울본부세관과 합동 수사에 착수했다. 피고인 20명의 범죄 수익 131억원에 대해 몰수 및 추징 보전 절차를 진행하는 한편, 다른 공범과 조직들에 대한 수사도 이어 갈 방침이다.     이번 사건은 지난해 10월 대구지검이 기소한 사건과는 별개다. 당시 대구지검은 외화 9348억원을 해외로 불법 송금한 2개 조직을 수사해 8명을 구속 기소하고 1명을 불구속 기소했다.",세계일보,2023-01-18 18:53:01
"‘조직 범죄 지능화’…검찰, 경찰과 수사 협의체 구성","[KBS 전주]전주지검은 날로 지능화하는 조직 범죄를 막기 위해 전북경찰청 강력범죄수사대와 '수사 협의체'를 구성했습니다.조직 범죄가 조직간 폭력이나 보호비 갈취를 넘어 대포통장 유통과 전화 금융사기, 도박 사이트 운영 등으로 진화했다고 판단한 데 따른 것입니다.수사 협의체는 사건 정보를 공유하고 적극적인 수사 확대를 통해 조직 범죄에 강력하게 대응할 방침입니다.지난달 기준 전주지검이 관리하는 전주 시내 폭력조직은 6개, 조직원은 백43명이며, 지난해에만 조직범죄 25건이 접수됐습니다.",KBS,2023-01-18 20:00:57
"‘조직 범죄 지능화’…검찰, 경찰과 수사 협의체 구성","[KBS 전주]전주지검은 날로 지능화하는 조직 범죄를 막기 위해 전북경찰청 강력범죄수사대와 '수사 협의체'를 구성했습니다.조직 범죄가 조직간 폭력이나 보호비 갈취를 넘어 대포통장 유통과 전화 금융사기, 도박 사이트 운영 등으로 진화했다고 판단한 데 따른 것입니다.수사 협의체는 사건 정보를 공유하고 적극적인 수사 확대를 통해 조직 범죄에 강력하게 대응할 방침입니다.지난달 기준 전주지검이 관리하는 전주 시내 폭력조직은 6개, 조직원은 백43명이며, 지난해에만 조직범죄 25건이 접수됐습니다.",KBS,2023-01-19 07:47:18
"""대출문자는 무조건 의심..전화금융사기 10계명""","SK텔레콤, 경찰청과 협력해작년 10만4990건 보이스피싱 전화 차단사이버 위협 대응 전담팀 신설사전 대응 기능 강화 
전화금융사기 10계명. 경찰청 제공 [파이낸셜뉴스] SK텔레콤이 최근 늘어나고 있는 보이스피싱, 스팸, 스미싱 등 사이버 공격에 대한 대응을 강화한다. 특히 설 연휴 기간에 전화금융사기 등 사이버 공격이 더 늘어날 것으로 전망되는 만큼 이용자 주의를 당부했다.   19일 SKT에 따르면 최근 경기 침체와 고금리로 인해 대출이 필요한 사람들을 대상으로 한 대출사기형 피해사례와 검찰·금융감독원 등 정부기관을 사칭한 피해사례가 증가하는 추세다. 경찰청은 이 같은 보이스피싱·스팸·스미싱 피해를 예방하기 위한 10계명을 만들고 사전에 사기 피해를 차단하기 위한 대응법을 공유했다.   SKT도 갈수록 지능화하는 보이스피싱과 스팸 및 스미싱 범죄 차단에 앞장서고 있다.   2021년 3월부터 서울경찰청과 협력해 보이스피싱 의심 번호 통화를 발신 차단하고 있으며, 인공지능(AI) 기반 스팸·스미싱 메시지 필터링 시스템을 운영 중이다. 지난해 10만4990건의 보이스피싱 전화를 차단하고, 7만2800여명에 대한 범죄 번호 발신을 차단했다. 이외에도 AI 기반 스팸·스미싱 필터링 시스템을 통해 약 6억5000만건 문자 스팸, 약 415만건 스미싱 문자, 약 56만건 음성 스팸을 차단했다.   SKT는 앞으로도 경찰청을 비롯한 유관 기관과 협력을 지속하고 AI 기반 스팸 스미싱 필터링 시스템을 고도화해 각종 통신 사기 범죄로부터 이용 안전을 지키기 위해 노력할 계획이다.   한편 SKT는 지난해 조직개편에서 사이버 공격에 대응하는 전담 조직 '사이버위협대응팀'을 신설했다. 신종 수법 기반 보이스피싱, 스팸, 스밍, 랜섬웨어 등에 대한 대응 전략을 수립 및 실행해 나갈 예정이다. #스미싱 #SKT #보이스피싱 #스팸 #차단 #사이버대응",파이낸셜뉴스,2023-01-19 14:27:03
"""여행사인 줄 알았다"" 보이스피싱 현금수거책 무죄 선고","범죄 눈치챈 피해자 신고로 현장 검거""여행사 대표 코로나19 걸려서 면접 및 고용계약 없이 취직된 줄"" 
서울남부지법 / 사진=연합뉴스  [파이낸셜뉴스]여행사에 취직한 줄 알았다가 보이스피싱 현금수거 업무를 맡게 된 30대 여성이 무죄를 선고받았다.   서울남부지법 형사4단독(김동진 부장판사)은 지난 11일 사기 미수 혐의로 기소된 A씨(30)에 대해 무죄를 선고했다.   A씨는 지난 2021년 7월께 성명불상의 전화금융사기 조직원으로부터 제안을 받아 '김지연 대리'라는 가명을 이용해 고액의 현금을 수거하는 역할을 맡기로 했다.   이후 또 다른 조직원들이 소비자보호원의 직원을 사칭하며 피해자에게 피해자 명의로 해외구매내역이 확인된다는 취지의 거짓 문자메시지를 전송하고 금융감독원 직원을 사칭하는 전화를 했다. 전화로 ""당신 명의로 국민은행 계좌가 개설돼 해외에서 범죄에 이용되고 있다""며 ""당신이 명의도용으로 인한 피해자임을 입증하기 위해서는 금융기관에서 대출을 받아 그 대출금을 금융감독원 직원에게 전달해 확인 작업을 해야한다""는 취지로 거짓말했다.   이들은 피해자에게 지난 2021년 7월 2일께 총 2차례 걸쳐 합계 4030만 원을 '김지연 대리'에게 교부하도록 했으며 3일 뒤에 피해자에게 재차 전화해 ""추가로 2,000만원 상당의 현금을 금융감독원 직원에게 전달하라""고 속였다.   A씨는 지시를 받은 대로 지난 2021년 7월 5일 오전 11시5분께 경기 화성시 한 초등학교 앞길에서 피해자로부터 현금 2000만 원을 교부받으려고 했다.   그러나 보이스피싱임을 눈치 챈 피해자가 현금 100만원만 건네줬고 잠복하고 있던 경찰관이 A씨를 검거했다.   재판부는 ""보이스피싱 현금수거책 범행을 감행할만한 범행의 동기가 없었다""며 ""또한 구직 과정에서 사업자등록증을 받아 확인하는 등 어느 정도 필요한 조치를 취했다""고 판단했다.   △A씨가 SNS에 게시된 여행사 구직광고를 보고 구직을 했으며, 구직 과정에서 사업자등록증을 요구해 확인하기도 했다는 점 △A씨가 대표이사가 코로나19 확진이 돼 2주간 사무실에서 만날 수 없고 격리 해제 후 정식 고용계약을 맺자는 말을 듣고 면접 또는 고용계약서 없이 채용된 점 △받아와야 할 물품이 ‘돈’인 것은 몰랐던 것으로 보이는 점 등을 고려했기 때문이다.   아울러 A씨가 적극적으로 금융감독원직원 행세를 했다는 증거가 없다고 봤다. 재판부는 ""피고인은 ""김지연 대리입니다""라고 말한 사실이 있을 뿐""이라고 전했다. #보이스피싱 #무죄 #수거책",파이낸셜뉴스,2023-01-19 18:13:01
"SKT, 설연휴 보이스피싱·스팸·스미싱 막는다","대출사기형 피해사례 및 정부 기관 사칭 피해사례 증가… 전화금융사기 예방 10계명고객 정보 보호 및 보이스피싱 등 Cyber 위협 대응을 위한 전담팀 신설
전화금융사기 예방 10계명.ⓒ경찰청[데일리안 = 남궁경 기자] SK텔레콤은 19일 설 연휴 기간 보이스피싱과 스팸·스미싱 사기 피해가 늘어날 것으로 우려된다며 고객들의 각별한 주의를 당부했다.최근 경기 침체와 고금리로 인해 대출이 필요한 가장 등 40~50대를 타깃으로 한 대출사기형 피해사례 및 검찰/금감원 등 정부 기관을 사칭한 피해사례가 증가하는 것으로 나타나고 있다.경찰청은 이러한 보이스피싱, 스팸·스미싱 피해를 예방하기 위한 10계명을 만들어 사전에 사기 피해를 차단하기 위한 대응법을 공유했다.SK텔레콤은 갈수록 고도화·지능화하는 보이스피싱과 스팸 메시지 및 스미싱 범죄의 사전 차단에 나서고 있다. 이를 위해 2021년 3월부터 서울경찰청과 협력해 보이스피싱 의심 번호의 통화를 발신 차단하고 있으며, AI 기반의 스팸·스미싱 메시지 필터링 시스템도 운용하고 있다.SK텔레콤은 이를 통해 지난해 동안 10만 4990건(전년 대비 3.2배 증가)의 보이스피싱 전화를 차단하고, 범죄 번호로의 7만 2800여명의 고객 발신을 차단함으로써 사회적 가치 측정 산식(SV)으로 환산 시 약 846억 원의 사기 피해를 예방했다.또 AI 기반 스팸·스미싱 필터링 시스템을 통해 약 6억 5000만건의 문자 스팸, 약415만 건의 스미싱 문자, 약 56만 건의 음성 스팸을 차단했다.SK텔레콤은 앞으로도 경찰청을 비롯한 유관 기관과의 지속적 협력 및 AI 기반 스팸 스미싱 필터링 시스템을 고도화해 각종 통신 사기 범죄로부터 고객들의 안전을 지키기 위해 노력할 계획이다.한편 SK텔레콤은 지난해 말 단행된 조직개편에서 회사가 보유하고 있는 다양한 고객정보와 회사 서비스를 이용하는 고객을 보호하기 위해 여러 위협에 대응하는 전담 조직인 ‘Cyber위협 대응팀’을 신설했다.앞으로 Cyber위협대응팀은 기존의 보안 위협 영역에서 더 나아가 신종 수법 기반의 스팸·스미싱, 보이스피싱, 랜섬웨어 등 사회공학적 범죄에 이르기까지 대응 전략을 수립·실행해 나갈 예정이다.SK텔레콤은 이날 자체 제공하는 서비스들을 통한 스팸·스미싱과 보이스피싱 사전 대응법을 소개했다.SK텔레콤 통화어플 T전화를 이용하는 것은 피해를 사전에 예방하는데 도움이 된다. T전화는 전화 수발신 및 전화번호 검색 시 해당 번호의 스팸 유형을 이용자에게 보여주고, ‘OO은행 고객센터’ 정보도 표시해 준다. T전화에서 상호 확인이 불가능하거나 정보가 없는 전화번호는 수발신에 주의하는 것이 좋다.또 SK텔레콤이 무료로 제공하는 T스팸필터링 앱을 다운로드 받아 기본적인 스팸과 스미싱 번호를 차단할 수도 있다. T스팸필터링 앱은 문자, 번호, 국번 기준으로 차단이 가능하고 원하지 않는 문자열도 차단할 수 있다. 앱은 원스토어, 앱스토어 및 구글플레이스토어에서 다운로드 받을 수 있다.통신사, 금융사, 정부기관 등이 보내는 스팸 및 스미싱, 보이스피싱 등의 주의 당부 안내문자를 미리 읽어보고 숙지하는 습관도 중요하다. 아울러 스마트폰에 스미싱 문자 탐지 백신을 설치하는 것도 피해를 예방하는 방법이 될 수 있다.",데일리안,2023-01-19 18:15:01
[열린마당] 보이스피싱 방법 진화… 의심하고 조심하자!,"최근 전화금융사기, 일명 보이스피싱 범죄가 급증하고 있다. 저금리 대출이나 대출금 상환을 목적으로 계좌이체를 요구하거나 수사기관을 사칭하여 금전을 요구하고, 심지어는 문자메시지로 자녀를 사칭하여 전자기기가 고장 났다며 부모들에게 연락해 수리비를 요구하는 피해 사례가 발생하고 있다.  나열한 수법 외에도 계속해서 범죄방식은 새로워지고 있으며 적은 금액부터 큰 금액까지 피해가 커지고 있다. 이러한 사기 범죄에 당한 피해자가 젊은 20대, 30대에서도 많이 나타나고 있다.  전보다 사회적으로 경각심이 높아졌고 경찰과 금융기관이 힘을 합쳐 홍보도 하고 있지만, 피해자는 계속 증가하고 있다. “나도 모르게 속아 넘어갔다”며 분통을 터뜨리는 보이스피싱 피해자들 모습을 보며 안타까움을 느낀다.  보이스피싱을 예방하는 데 중요한 것은 경찰, 검찰, 은행 등 그 어떤 정부 금융기관도 신분증이나 신용카드 사본 등 개인정보를 당사자에게 요구하지 않는다는 사실을 유념하고 또 유념하는 것이다. 만약 비슷한 내용의 전화가 걸려오면 의심부터 해야 하고, 돈을 송금했다면 신속히 금융감독원(1332), 경찰(112)로 신고를 하고 계좌 지급정지 신청을 하자.",세계일보,2023-01-19 23:35:03
가족들과 과거 얘기하다 '욱'…설 연휴 '가정폭력' 신고 급증,"평소보다 30% 이상 더 많이 발생…작년 설 하루평균 193건 접수경찰, 24일까지 '설 명절 종합치안활동' 기간으로 선포
사진=연합뉴스설 명절에 가정폭력 사건이 평소보다 30% 이상 더 많이 발생하는 것으로 나타났습니다. 경기남부경찰청에 따르면 작년 설 연휴 기간 하루평균 193건의 가정폭력 신고가 접수돼 평소 하루평균 141건에 비해 37%가 많은 것으로 집계됐습니다.앞서 2021년과 2020년에도 설 연휴에 가정폭력 신고 접수가 평소 대비 각각 37%, 32% 정도 많았습니다. 작년 2월 1일 설날을 맞아 성남시 집에서 술을 마신 한 남성이 가족들과 과거 갈등을 빚었던 얘기를 나누던 중 화를 참지 못하고 딸을 폭행하는 사건이 발생했으며, 같은 날 부천에서는 차례 준비에 관한 말다툼 중 외국인 여성이 남편을 할퀴는 등의 폭행을 해 경찰이 출동하는 일이 벌어졌습니다. 이처럼 설 연휴 기간 가정 내 사소한 다툼이 큰 싸움으로 번지는 등의 사례가 많아 경찰은 가정폭력 신고가 급증할 것으로 보고 철저하게 대비할 방침입니다. 이에 따라 각 경찰서를 통해 관내 가정폭력 우려 가정 4,000여 가구 및 학대 우려 아동 600여 명에 대한 현황을 공유하고, 해당 가정에서 신고가 접수될 경우 더욱 적극적으로 대응하기로 했습니다. 한편, 경찰은 설 연휴가 끝나는 24일까지 '설 명절 종합치안활동' 기간으로 선포하고 가정폭력과 스토킹 등 사회적 약자 대상 범죄와 전화 금융사기 등 민생 침해 범죄에 대해 신속‧엄정 대응할 방침입니다.",MBN,2023-01-21 09:50:15
“유학 간 딸 잡고 있다”…부친 협박해 3시간 동안 4000만원 뜯어낸 보이스피싱 일당,"딸 유학 보낸 피해자 A씨, 딸 번호로 걸려온 전화 받자 “어떤 남자가 내 방에 있어”라며 흐느끼는 여성 목소리 들어남성 협박범, 전화 끊지 못하게 유도...3시간 걸쳐 3970만원 뜯어내돈 모두 받자 “새해 복 많이 받아” 희롱하기도 
   피해자에게 현금을 받기 위해 다가오는 보이스피싱 조직 수거책. KBS 뉴스 영상 캡처       ‘유학 중인 딸을 인질로 삼고 있다’며 피해자에게 4000만원 상당을 뜯어낸 전화 금융 사기(보이스피싱) 협박범 일당의 행각이 공개됐다.      21일 MBC에 따르면, 16세인 딸을 캐나다로 유학보낸 A씨는 지난 13일 송파구에서 ‘강아지’로 저장된 딸의 번호로 걸려온 전화를 받고 충격을 받았다.     딸은 흐느끼면서 “아빠, 지금 어떤 남자가 내 방에 들어와 총을 들고 나를 위협하고 있어. 무서워”라고 호소했다.     이윽고 딸의 옆에있던 듯한 남성이 전화를 받아들었다. 그는 A씨에게 “돈이 목적이다”라며 전화를 끊지 않은 상태에서 현금을 찾으라고 요구했다.      이에 A씨는 편의점에 들려 차량용 충전기를 구입했고, 협박범이 현금 수거책과의 접선 장소로 지정한 몽촌토성역 인근 현금 인출기에서 800만원을 인출했다.     협박범은 “몽촌토성역 2번출구 앞에서 기다리면 내가 보낸 애가 도착했거든? 기침 소리를 낼 거다”라며 “그 애들한테 800만원을 건네라”고 요구했다. 협박범 일당이 몽촌토성역 인근에서 A씨에게 빼앗은 돈은 1350만원이었다.     A씨가 “딸과 통화하게 해달라”고 요청하자 협박범은 “아직 끝나지 않았잖아”라며 거부했다.      범인의 말대로 A씨의 피해는 여기서 그치지 않았다. 협박범은 이번에는 고가의 금을 구입할 것을 요구했다.     “XX 백화점 11층에 XX금거래소가 있다”며 “거기서 신용카드로 최대 한도만큼 골드바 사줘”라고 지시했다.     간절한 A씨가 “딸을 안정시키게 통화 좀 하면 안되겠냐”고 하자, 범인은 “바꿔주겠다. 야 이리 와 봐”라며 한 여성과 통화를 시켰다.     여성이 흐느끼는 목소리로 “아빠”라고 말하자 A씨는 “걱정 마라. 아빠가 처리하고 있으니 무서워하지 말라”고 안심시키려 했다. 여성은 “무서워, 무서워”라고 조아렸다.     
   A씨와의 전화 통화에서 흐느끼는 듯 연기하는 여성 공범. KBS 뉴스 영상 캡처       A씨는 전화가 여전히 끊어지지 않게 하기 위해 갓길에 차를 세우고 휴대폰을 충전시킨 채 백화점에서 920만원 상당의 금을 구입했다.      자신의 요구대로 A씨가 움직이자, 협박범은 더 대담하게 요구했다. 그는 “집에 가서 부인의 카드나 다른 카드를 챙겨서 나머지 현금도 찾아라. 할 수 있는 데까지, 오케이?”라며 줄기차게 갈취를 시도했다.     A씨가 잠시 망설이자, 범인은 “지금 애가 몇 살이야. 이제 열여섯? 성인 안됐죠, 아직?”이라며 그의 딸을 성폭행할 수 있다는 암시까지 했다.     결국 A씨는 계좌에 보유중이던 1000만원과 지인에게 빌린 700만원을 각각 강남역과 삼성역에서 협박범이 지정한 흰색 잠바 차림의 수거책에게 전달했다.      A씨는 이날 3시간에 걸쳐 5곳에서 3970만원을 빼앗겼다.     돈을 갈취한 협박범은 “오늘 수고했어요. 새해 복 많이 받아. 돈 잘 쓸게”라며 “건강하고 안전한 것에 감사하고 잘 사세요”라며 마지막 순간까지 A씨를 희롱했다.      그제서야 전화를 끊은 A씨는 서울 강남경찰서에 강도 사건을 당했다며 신고했다. 하지만 경찰서에서 A씨는 실제로는 아무 문제없이 지내는 딸과 통화하게 됐고, 보이스피싱임을 뒤늦게 알게돼 울분을 터뜨렸다.     A씨는 KBS와의 인터뷰에서 “(경찰이) 보이스피싱이라고 얘기하는데도 믿기지 않았다. 그런데 나중에 딸과 통화가 되고나서야 알았다”면서 “우휴증이 너무 크다. 후회감과 분노가 너무 심하다”고 억울한 심경을 토로했다.     경찰은 현재 A씨 딸이 이용했던 유학원의 인적 정보가 해킹당했을 가능성에 무게를 두고 수사를 진행중이다.",세계일보,2023-01-21 13:48:03
